{
  "evidence_package_version": "1.0.0",
  "original_run_id": "scientific_full_7b_001",
  "original_package_version": "2.15.5",
  "original_qualification_version": "0.4.1",
  "original_commit_sha": null,
  "model_id": "synthetic-7b",
  "model_revision": "1.0",
  "model_digest": null,
  "tokenizer_id": "synthetic-tokenizer",
  "tokenizer_revision": "1.0",
  "provider_class": "REAL_MODEL",
  "runtime_type": "real",
  "benchmark_sha256": "091807f83627dfa60b6cd64437b567660db1165ffbc7e681db2a6ccec7d5f022",
  "split_sha256": "c348ec5ae2a8fc7e1f5ad0a3909ad68dfc46efe08554ab08e6ac5d0b2183c533",
  "counterfactuals_sha256": "741fc9969669e36cdd12febf6807196525d1cfc277263f847d9fa8ef42ce8b06",
  "candidate_policy_sha256": "80e0f8805b8057b03ea2fc050b1e6ef1b36eee94db311c6839819219193a0214",
  "sham_policy_sha256": "4e5a8a9b9e8ff324c7b8f316bcab64886e9d92a68c9b6ec74a64a5dc3425788d",
  "baseline_results_sha256": "2475b5c6e194ad5fb5c13302203078c5cc6c7eda8f0a8ec1c89d49722e7045c6",
  "candidate_results_sha256": "7f4ab691730e17874d53844750e80e9109237828fc11c16e0ae9badee260b74b",
  "sham_results_sha256": "eed032ed78f39523665d9d3a83a61c34ab8d3fc54d481372bde08b7500257f52",
  "oracle_results_sha256": "9df6459bc05d6ee95c7bf5caacc0ec47782bc3a987609ba8a6baf1a3c710da6a",
  "gate_a_results_sha256": "3044f5361af4e06ce835bdbfd8f98c96b529b05cb45e181adc7a75bfadfcd33e",
  "source_provenance_sha256": "e1dfcd10fd5186bd67f74e112ee8cc34068110b8dce878fe0653a84dcfe7d6e5",
  "creation_timestamp": "2026-07-31T08:39:10.047075+00:00",
  "immutable": true,
  "scientific_result": "negative",
  "promoted": false
}